text,label
"Researches into humanities and art still need large amount of money, what's more, government's big budget on universities may attract more excellent intellectuals and researchers into the country and enjoy a higher reputation worldwide.",Claim
Some people might argue that economic issues are global and critical as well thus can not be put aside.,Claim
Allowing them to think freely will give them an opportunity to express themselves as ideas can naturally flow when there are no limitations.,Premise
This example demonstrates how people might take numerous elements from their roots and history to proudly display them while supporting their team.,Premise
"However, while life in those cities is good in some ways, I completely argue that people's health would therefore be affected negatively.",Claim
Research on making computerized drone soldiers (unmanned computer controlled) is going on.,Premise
This makes us a lazy person who prefers to do sedentary activities like watching television shows rather than be active and sociable.,Premise
"Another significant fact which should be taken into consideration is that by the help of teachers, students can understand ideas faster and easier since teachers explain them thoroughly in the class and after that give them a lot of examples to clarify the points.",Premise
"In conclusion, even though the introduction of the early retirement has some benefits, it is convincing that it would generate a sense of discrimination among different age groups and increase the government financial pressure accordingly.",MajorClaim
I have several reasons to believe its disadvantages outnumber the few advantages.,None
"First of all, traditional skills and ways belong to value of culture.",Claim
They cheat young ages because they believe they are immature and they can trap them easily.,Premise
"Consequently, I can make a phone call or write email to my parents whenever I want.",Premise
"In addition, the unemployment rate is always high, so their parents want children to study these subjects which can help students have a job.",Premise
"For me, I prefer spending money in a coffee shop to staying at school to finish my assignment.",Premise
"Boys and girls will try to show their capabilities and abilities in the class, therefore they will study increasingly.",Premise
"New challenges from different tasks amounts far more than more works, it also means through dealing with it, I will obtain more knowledge and experience.",Premise
They teach us how to appreciate beauty and express feelings in a creative way.,Premise
"Although it is true that life changes rapidly, there are many things in the past that we can learn about, such as mistakes, success and knowledge in many fields of study.",Claim
"But to me, learning about life through personal experience seems more appropriate.",MajorClaim
This is a very important aspect in the work environment.,Premise
These kinds of languages are usually difficult and unpopular.,Premise
"Therefore, they should be able to deal with the obstacles that they may encounter.",Premise
"To begin with, communication between countries and cultures become convenient.",Premise
"First of all, foreigners came here always received the support of friendly volunteers who were young students.",Premise
"On most occasions, the process of extinction of some species is irrevocable and we can do nothing about it.",Premise
"While living in a foreign country, students can learn a lot about the culture of that country.",Premise
"Furthermore, most of these juveniles are students so they would need their parents to support them financially for what they want.",Premise
"Nowadays, the Earth has become like a small village.",None
"For example, students will choose a career that they want including the job with high salary include.",Premise
"Futuermore, no matter who you are a top-level managers of a company or a low-level employee of that company, relating well to people is also a importent issue.",Premise
"By way of conclusion, it is true that the development of the health care system helps people have a better life.",MajorClaim
I firmly believe that the zoo is so useful for the earth.,MajorClaim
"Thanks to ads we learn about new products, we can compare them and choose whats the best for us.",Premise
That is good for both of the professor and students.,Premise
They have the life of a person at their discretion.,Premise
"However, university is not just about academic studies but also a place to nurture artistic talent and develop soft skills.",Premise
"Secondly, capital punishment is certainly not the only option to control the amount of crimes, life imprisonment is just as effective by detaining the criminals in prison for the rest of their lives.",Claim
"However, even though I used it for couple months, I still do not know how to use all the features proficiently.",Premise
It is obvious that there are many programs on TV or movies that are harmful to children in metal and physical health.,Claim
"Since in an apartment you don't have a roommate, you won't have this problem, and as a result you would be able to concentrate better.",Premise
"Although some people argue that children should be free to spend money to they what they want, In my opinion it is very important to learn our children from their beginning of their life to be financially responsible persons, because our personality form in childhood and it is not easy to change it in adulthood.",Claim
A miscalculation of the orbit in launching rocket may lead to a failure of the whole project which might worth trillions of dollars.,Premise
"To begin with, type of temper is one of the reasons that make me to choose individual work instead of team one.",None
"These days, it is so hard for young people to get a proper job when they have not degree certificate from Universities.",Premise
The local people may also regard them as a special group as well and separate them from the main-stream society.,Premise
"First of all, public transport is a key factor to minimize the number of vehicles on the street.",Claim
"It is undeniable that cheap air fares have broadened travel possibilities for many people, particularly for the lower income group.",Claim
"First of all, it promotes the communication and interaction between different countries more conveniently and clearly.",Premise
Some people think that it does not matter what is reason behind committing a crime therefore there should be fixed punishment for a specific crime.,None
It is a well known fact that a jury involved in a case has no information regarding the criminal's past illegal acts under the British and Australian laws.,None
"Recent years, however, has seen a rapid increase in the number of vegetarians.",None
"Admittedly, some countries may place economic developments ahead of environmental protection, thus ruining the local environments.",Premise
"In conclusion, it is indeed evident that age limit should be set for retirement.",MajorClaim
Capital punishment is a controversial debate in many countries.,None
"As a authoritative dentist in my province, my mother has worked for 25 years.",Premise
"In the past few decades, there were many remarkable achievements in technology fields that have numbers of beneficial effects on the whole society or individuals, although bringing some disadvantages to us.",MajorClaim
Living in a new country requires a great amount of flexibility and adaptability in one's character.,Premise
"I completely agree that government should provide those education to their people; however, for the more higher education like university, the students or their parents should pay for the fees.",MajorClaim
"So, the government have to invest more for it and encourage people to use.",None
"As far as my opinion is concerned, I find myself aligned with opponents of the usages of nuclear power.",MajorClaim
"In other word, tourism helps divert the local economy to its right direction, which exploit the best out of its own potential.",Premise
"In the modern society, internet is considered as one of the most important inventions over the past century.",None
"Nowadays we are facing a global economic crisis and it is necessary for both parents to work, hence there is only limited time for them to teach their children.",Premise
He or she should always keep the passion in her field so that he or she could push him/herself forward all the time.,Premise
"At a certain time, they may presume that a securing job is the most important and necessary because they need to earn money to manage their life.",Premise
"However, on the other side of the coin are voices in the opposition, saying that universities provide not only skills for careers, but also academic knowledge for the human race, such as bio science, politics, and medicine.",Claim
It is confirmed in a number of researches that daily usage of elevators in workplaces promotes obesity.,Premise
"Further, by means of some communication tools, it has become very easy to make new friends.",Premise
"Moreover, people, suffering from the population pressure, are expanding their living area; consequently, the living area of other species narrowed.",Premise
"Virus programs, privacy breach, leak of confidential documents, cyber attacks, identity theft, frauds etc.",None
"Just imagine if the project your company is sponsoring effectively improves the environment, then your company would be known as an environmentally-friendly company and benefit from it in this consumer-oriented society.",Premise
"If you did, it was probably at a zoo.",None
"Obviously, police officers can force a criminal to surrender, because they have a weapon which will prevent an escaping criminal who poses a serious danger to the public.",Premise
"Secondly, new technology has created some similar jobs all around the world.",Claim
Should people be forced to stop working?,None
Telephones and email make me feel personal because I could directly connect with people that I love.,Claim
"Although developing technologies to discover amazing thing in galaxy is interesting, there are many people in the world are in poverty or starvation.",None
Ultimately I feel that schools which obligate their students to take standardized tests are right.,MajorClaim
"Even if their performances are just some simple drawings and melodies, music and art still bring out children's joy of flying in imagination.",Premise
Restrictions would just curb the innovative ideas of the artists and would limit their brains.,Premise
All people should give a hand to do this better and governments play a vital role on encouraging and distributing those.,None
"In addition, it is easier for students to get help when facing problem such as if students have problem in solving their math question, they can easily ask for help to their roommates, classmates, or teachers.",Premise
"For youngsters, maintaining their desire to win often develops many outstanding characteristics whether they participate sport events or not.",Premise
Many people find that students at schools and universities still learn much more from lessons with teachers.,Claim
"Criminals who don't have any chance of improvement or who have a past record of such crimes are, therefore, given capital punishment.",Claim
"To sum up, students can learn outside the textbook and classroom with a real working experiences that can be a great opportunity for future job consideration whereas organizations earn much more as they can not only save time and money but also be enlightened by what young people have to say.",MajorClaim
"In conclusion, providing professional training as a reward for good work has many advantages.",Claim
"Firstly, an increase in the number of automobiles brings about environmental pollution.",Premise
"If the art displays unreality, the public audiences certainly have the acumen to recognise its untruthfulness and only appreciate its art value; if the art reflects the reality, then what would be the intention to ban it if it was not for covering the dirty truth?",Premise
"In sum, although each choice - few close friends or a large number of friends - presents its advantages and its weak points, I think that spending time with a large number of friends can add more to one's life.",MajorClaim
"In the ancient time, the different languages and geography set barriers for people to exchange their goods and ideas.",Premise
"Science today, for example, is said to be more and more specialized, but in order to solve a problem scientists have to combine knowledge from chemistry to physics.",Premise
"It is not to say, of course, that other points of view are completely without merit.",None
Luck is something intangible and no one can guarantee that it would ever come your way.,Premise
Having one's own hobbies and doing physical activities can bring us a lot of benefits.,MajorClaim
Classes are designed diligently for the students and professors absolutely bear more knowledge than the students.,Premise
"Universities must admit both in equal numbers, depending on their choices.",MajorClaim
I was able to save a lot of money by sharing wasted heating and rooms with my friend and splitting the bills.,Premise
"Further, government should motivate and encourage the people to use alternative sources such as the solar and the nuclear energy.",None
"For example, they can get poor eyesight in early ages of childhood, and also develop back pain.",Premise
They must take only a bus to go to another place.,Premise
"Therefore, it is no doubt that they play roles as a mother and as a wife better.",Claim
It is natural they behave in that way because television shows don't require any participation.,Premise
This is because graduates can work in various kind of works which they can select a job they prefer.,Premise
"As the saying of a Chinese writer, the color of life is rooted not in Japanese cherry blossom or Canadian maple leaf, but rather there always exists new things and challenge.",Premise
"Right to education is a basic human right of both, males and females.",Premise
They do not undergo any pain or misery.,Premise
I am biased towards the opposite side that businesses had better not employ the workers for the whole of their life because of the three main crucial reasons.,MajorClaim
"Today, we are able to read the news all over the world, to chat with people through the Internet, or to travel around the world by planes; however, it also means that any thing happens in the world will affect our life.",Premise
We cannot ask the people of the jet age to go back to the age of the bullock cart.,Premise
"In order to create a better living environment for ourselves and our offsprings, our behaviors must be asked with politeness and good manners.",Premise
"Recently, some people argue that government should invest more on medical care and education rather than on entertaining or sports facilities.",MajorClaim
"Therefore, those local residents have to clean the place frequently so that the new batch of tourists will have a tidy and neat environment.",Premise
"When witnessing our national flags flying proudly among others, many of us can stop hiding our pride and happiness.",Premise
I do believe that great success requires taking great risks.,Premise
Commuincation can bring many benefits.,Premise
"The contribution of the mobile phone to our modern society is prominent and people's dependence on it is irreversible, although it has a number of problems that should be well handled.",MajorClaim
"In my opinion, it will yield more negative results than positive ones.",MajorClaim
"Connection with friends improves their IQ abilities, furthermore, they have a chance to learn about their societies.",Premise
Many people advocate that technology makes their life easier.,None
"Therefore, I think this matter should be controlled by parents or somehow by directors.",None
They show the lifestyle of people who lived in thousands of years ago.,Premise
"Whenever I met a difficulty, I would reach him for consulting.",Premise
"Life is full of challenges, difficulties and unexpected obstacles.",None
"Even though his friends and I were total strangers to each other, we quickly got to know each other.",Premise
"Unlike traditional classes, distance education courses don't take place in a classroom, where you are surrounded by your teachers and classmates.",Premise
"First and foremost, carbon emission cut is significantly essential for protecting the atmosphere.",Premise
He can feel the sweetness of triumph because he did not stop pursing his goal.,Premise
"Consequently, it would affect all taxpayers whether or not they benefit from the use of the funds.",Premise
"Thus, mediocre students should have opportunity to be trained in college and university.",Claim
He looked at every aspect that he needed to qualify for the promotion.,Premise
"Try something new can indeed make people become special, while it does not mean successful.",Premise
"Via internet they can have connection with the other children all around the world, therefor they can exchange their knowledge, they can learn different cultures.",Claim
"However, as far as I am concerned, I strongly agree with the view that this great invention causes many social problems.",MajorClaim
"Majority of the families buy cars simply for a safer and easier conveyance, and charging them too much fee adds a lot to their burden and is actually jeopardizing their rights.",Premise
"At all times, think about the other's feeling before doing any self-centered action would help to improve the roommate relationship tremendously.",Premise
"Thirdly, doing something which an individual doesn't enjoy can led to enjoyment.",Claim
Therefore schools should consider giving several small vocations to the students during the year.,MajorClaim
It is not for which Ronaldo is more fortune than me.,Premise
I agree that in this occasion the government is not granted to hand in.,MajorClaim
We can not be leaders by reading books or by listening to person talking about leading.,Premise
"In case there is anyone who brings up some sensitive issues in their films or books regarding any races, this might end up in some chaos among the society.",Claim
It is absolutely a major problem.,Premise
You will grow to be dependent and reliant.,Premise
"Some reporters are more interested with gossip than news relating to public issues, paying too much attention to the personal lives of famous people.",Premise
"Zoos are big outdoor spaces in which different animal species are kept, so that people can look, learn and admire them.",None
"I personally suppose that no matter how widely they are spoken, every language should be protected from being disappeared.",MajorClaim
The young adult has to try to create memories with his dad and mom in the early age.,Premise
"Continuous technological and economical development in modern world created great differences between cities, a difference that is clearly visible in the size of various cities.",None
"I mean, when you work hard you decrease portion of chance in your success.",Premise
Educational institutions have different systems when it comes to introducing foreign languages to children.,None
"This would affect their studies, they loose their interest from studies.",Premise
"Secondly, it is obvious that in many aspects such as communication, trade, cooperation as well as transaction, it will be absolutely easier for the whole society to work together in one language only.",Claim
Universtiy is an entrance to life.,None
From cities with more that 20 million people to small towns inhabited by only hundreds of people.,None
I think I still have to point out that there are some different points of view.,None
"Nevertheless, some argue that there should be government restrictions in order to limit their opinions.",None
"Based on the reasons demonstrated above, I believe that living in a higher pace is better because the advantages of this are qualitatively greater than that of the opposite.",MajorClaim
"I favor the latter; that is, successful people still do things they already know.",MajorClaim
It's more efficient and straight-forward than talking in the phone.,Premise
"To conclude, I definitely feel that the current way of the juries judging the case should be transformed and they should know the facts about the criminals they are dealing with.",MajorClaim
"In the first place, children behaviors are the most concerning matter which parents are always trying to do their best.",Premise
"Many people believe that students only need to study academic subjects like mathematics, physics because these subject are necessary for students' future.",Claim
"To quote an instance, in my school we used to get several vacations after our quarterly exams.",Premise
"The first group was asked to discuss in person, while the second group was asked to discuss by email.",Premise
"In addition, execution does not resolve the consequences of crime, not to mention it could put the criminal's family through hardship while the pain of the victim's kin is never to be consoled.",Premise
"Children are not mature enough to make a judgment of what is good or bad, therefore they are likely to imitate the behaviors on TV out of their curiosity.",Premise
"For example, from the Internet, students can read many articles and e-books and can watch video tutorials which provide the information more apparently.",Premise
Some people prefer to spend their free time indoors.,None
"If people in poorer countries gain access to these drugs, their health situations may be better.",Premise
"Even in some cases, people compose a message with only emoticons (the expressions by face created by service providers), which means there is no room for writing or typing texts.",Premise
In my opinion universities should invest in libraries more than anywhere else.,MajorClaim
"This step has curbed down the numbers of smokers in the country and as a result, Brunei remains a place known for its tranquility and cleanliness.",Premise
"My cousin Pedro literaly hates to visit museums but he really enjoyed his visit to the famous London - Madame Tussaud museum, it was kind of art entertainment but also that visit helped him to understand the artist works, and in addition he started to respect and admire other types of arts that offers in other museums.",Premise
"From my point of view, it is sensible to enforce the gun control.",MajorClaim
"When I was ten years old, I was a shy girl.",Premise
"However, I agree that aiding poor countries has positive effects, overweighing its side-effects for the several reasons.",MajorClaim
"In my experience, many times I did not attend biology class because my university does not require the students to attend classes.",Premise
"First, in my view spending too much money for equipping the gyms or constructing football/basketball courts are really not necessary to encourage students to do sports.",Claim
"It is undeniable that traditional education has its advantages in face-to-face communication, mental inspiration and physical educations.",Claim
"Nowadays, the use of advertisement through different forms of media such as newspapers, radio and television has become very prevalent, so it is thought to be a necessary part of today's society.",None
"Otherwise, another vital reason why new building construction deserves more governmental investment lies in the fact that it requires far more resource compare to old building preservation.",Premise
"It is true that the government can provide some fund to ease their difficulties, but such financial help is usually far from enough.",Premise
"To sum up, although mobile phones make our communication faster, it also gives rise to many social problems such as children's social skills and their mental health.",Claim
"Therefore, I believe that having and raising children should not be different than any other daily activity.",Premise
"I know someone who wakes up in the morning and before even eat he turns the television on, he even records the programs he cannot watch during work hours.",Premise
"So, government take care of this issue by declare regulate to control emission of carbon dioxide.",Premise
"However, what if one finally find out him or her has the talent in other filed.",Premise
"At this moment, they would totally involve in the ocean of art and their stressful nervous would be relieved.",Premise
It is certainly clear that the advantages of early introduction of foreign language outweigh its disadvantages.,Claim
Prohibit public smoking?,None
"In addition, the learning with a teacher makes us bear more burdens of studies cause they assign us homework, Nevertheless, I prefer to learn with a teacher rather than learn by myself.",MajorClaim
"Of course, it may be true when talking about this topic.",None
"In order to make people better off, it is more urgent for governments to commit money to some fundamental help such as setting more scholarships in education section for all citizens.",Premise
He started regretting afterwards and now trying to manage his work but it seems to be too late for him.,Premise
"It is not to say, of course, that other points of view are completely without merit.",None
"In the past, people might have had pen friends in other countries, but now, thanks to the social networking websites, people can easily to find someone who has similar interests.",Premise
"But now many people, including me, have been tired with it.",Premise
"While there are innumerous people will deem it ridiculous and argue doing the same task is the meaning of job, but from my perspective, I am on the side of my father.",None
"When the distance is longer and harder to achieve, a runner who can go beyond his limit will proud of himself.",Premise
