text,label
Nowadays men and women are equally participating in every field.,None
The similar experiment done by other scientist show the same result that people can reach an agreement quickly if they could talk to each other.,Premise
"First of all, a large factory can stimulate local economic growth and reduce the unemployment rate.",Claim
We have no choice but have to live in a fast pace.,Premise
"Moreover, when people have jobs, they will have money to spend on goods and services.",Premise
"In conclusion, despite the contribution of IT to the society, its effect on the users' independence and prositution should not be out of concern.",Claim
"Every time I asked him why, he will say, seriously,"" I am done, doing this same work for 20 years and I really want to try some different, that is all.""",None
"I think when we leave school, maybe we will forget parts of the lessons we learn at school if we do not experience them in life, but I strongly believe we will never forget what our parents have taught us because we use it every day.",Premise
"In summary, students should find interesting subjects and acquire general knowledge to prepare higher education at tertiary education.",MajorClaim
"Lastly, the studying conditions are better in an apartment because you don't have all the noise and distractions that you often have in dormitories.",Claim
It is undoubtedly certain that students can gain their practical experience by getting involved extra jobs.,Premise
"All professors and students need to have a modern and well-equipped library because, after internet, library plays an important role in research.",Premise
I am in favor of that idea because of their advantages and the fact we can see today about the use of these new means.,None
It will make the world more peaceful by easing internation tensions and releasing patriotic emotions in a safe way.,MajorClaim
"They will have to pay a lot of bills, because they will have to find a lodging or at least a place where to live and in order to have less expenses they will have to find a co-tenant, who they may not like.",Premise
Living in their own houses will save the young adults a lot of money.,Claim
"As a result, the productivity of the class will be increased.",Premise
The animal experiments accelerate the vanishing of some categories of animals.,Premise
"With advanced technology, many things that seemed impossible in the past, have become realities.",None
"Lastly, family is a root of society.",Premise
And it's worth to spend more time on it than on teaching.,None
"There are many advantage of these invention, telephones and email.",None
"However, the relationship you need to maintain with your co-worker is the most important one since he or she is the person who works very closely with you, and in most instances you have to rely on him or her.",None
"For instance, students who used to prepare Microsoft PowerPoint presentation for their school projects, get an edge over others at an early stage of their career.",Premise
"Besides, high school must be responsible for their future with well-planned curriculum.",None
"Moreover, future prospects of computers are very bright.",Claim
They will try to create a beautiful image about their land and people.,Premise
So persons in big cities have more chance to get the better job than people living in small towns.,Claim
What is the best way to orientate the students?,None
It is felt by many that the usage of machines is harmful for health of humans since machines decrease the work done by people.,Claim
"Right from sculptures to paintings, books to drama and movies, all these artistic works have reflected the contemporary social issues of different eras.",Premise
This has an overall effect on personality and future of an individual.,Claim
"To keep their jobs, children will have to try their best to finish their duties.",Premise
"Most people want to work for an employer, because they want to feel secure about their salary, or feel comfortable about other problems of having own job such as paying tax, worrying about selling, etc.",None
"Besides, classroom courses are also provide students to learn social skill.",Premise
"But working alone is a longer-term job than communicating, that is, the ability of adapting oneself to a new environment may be necessary for a fresh worker, but the excellent knowledge of this job will be benefit till one leave.",Premise
"First and foremost, various ideas and creativity from different people are indispensable for a company to flourish.",Claim
There are those who said that student can attend the university coarse without passing the exam.,None
"It is not to say, of course, that other points of view are completely without merit.",None
"Furthermore, the factories and companies will have abundant human sources to ensure the pace of manufacture and also devising lots of unique ideas.",Premise
"Besides, organization have been transformed to customers oriented.",Premise
"Beneficial changes will certainly take place if changes are made because for a change to happen, changes have to be done.",None
"In fact, many tourists around the world marveled at the perfect synthesis of the modern technology and the traditional culture.",Premise
"Social networks such as facebook, twitter have changed traditional sources of information and decreasing the monopolization of the information by the governments.",Premise
"Nowadays, many professors conduct research while teaching in colleges or universities.",None
"The fact is that such news media as televisions, radios, or newspapers are bringing many news on entertainment sector from all over the world to everybody.",Premise
"In your job you can be boss of yourself; however, in the other jobs someone else are your boss.",Premise
"In conclusion, a friend is a person you care about.",Claim
I don't have to worry about any other thing can make my opinion become unpersuasive.,Premise
"In addition, I can work long hours for earning more money.",Premise
There are many ways of teaching.,None
"To sum up, I would have to say that although we can use the ability of adapting oneself in a new environment, the excellent knowledge will be of more importance.",MajorClaim
"From all analysis suggested above, professional athletes and singers are overpaid in terms of their contributions.",MajorClaim
"We are told at what hour we shall wake up, how we shall dress up and how we shall behave.",Premise
Thus zoos are needed to keep the nature balanced.,Premise
"Second, technology widen children's knowledge.",Premise
"As a lover of travel, a quintessence of any visit to an excellent museum of a new place would be the best part of a tour, which can be explained by the following reasons.",MajorClaim
"Some believe when a person faces with a failure the best way is to forget that and releases that; however, I completely disagree with this idea.",None
Some people might argue that people enjoy watching TV when they know they can learn many things such as learning a language by watching movies.,Claim
This is chiefly to shield oneself from being harmed by any intruders or robbers.,Claim
"In order to build city and factory, people destroy huge forests.",Premise
"Since we are informed with devices that are produced with new features nearly every day, many people often get lost.",Premise
"First of all, as we all know, animals are friendly and vital for people, because if there are no animals in the world, the balance of nature will broke down, and we, human, will die out as well.",Premise
Working without pressure and interaction are some examples for these disadvantages.,None
"To sum up, if all those factors are contemplated, it is obviously found that there are many solid reasons to support my viewpoint.",None
"Nowadays, many young people consider mobile phone as the most important thing in their lives as it keeps them constantly organized and it provides much convenience for them to reach out their families and friends.",None
"For example, when I did not know what major to choose when I attend university, my father told a lot about different majors.",Premise
Many people consider that the drawbacks of this phenomenon outweigh its merits.,None
The first reason why the father's role should be equal to the mother's role is the nature of parantage.,Claim
At the end he was not only able to get the promotion amidst a stiff competition but also got nominated for a foreign scholarship since he had more credentials than other officers in his capacity.,Premise
"Therefore in my view, a good co-worker needs to have three most important characteristics such as cooperation, trustworthiness, and fellowship.",MajorClaim
We can accomplish our assignments with little help of a teacher within less time than do it by ourself.,Premise
"In a nutshell, the advantages of upgrading the roads which I mentioned above are totally convincing and indispensable.",MajorClaim
"As an example, I got too much stress from the school.",Premise
"Secondly, in the area of education, it is generally agreed that poorer countries often lack of teachers in schools as well as lecturers in higher education institutions.",Premise
"They not only free to do whatever they want without any confine or punishment, but also they are free and have a lot of time in their hands to try and experience new things and enjoy them.",Claim
"It is said that, surprisingly, he never tried to distinguish a hand soup and a facial soup because, at least for him, using two different soups properly was quite annoying.",Premise
"Thus, without the prevention on criminal details, the unlawful behavior would be more and more severe and the social harmony would be broken.",Claim
"You can improve your skills by work under any professor; you can ask questions face to face, it will clear your doubts.",Premise
"Instead, the establishment of medical facilities or educational institutes is aimed to improve the health or education standard rather than earning profits, which deserves more funds from government.",Premise
"Melancholia, the most fatal problem, even leads some people to commit suicide.",Premise
"In fact, parents' support is one factor which makes people succeed in their life.",Claim
"In facts, young people will be happy as their parents, grandparents are healthy.",Premise
Do you think they have built by chance?,None
"Firstly, some people suggest that qualification should be the foremost measurement to determine the value of a employer.",Claim
"In conclusion, I strongly prefer studying in a group of my friends because of some important opportunities gaining with this activity.",MajorClaim
Almost every school develops their online class systems.,None
Students could study in class that have teachers who have experienced and greater performance.,Premise
"The only disadvantage is the nosiness of competitions which students will participate, but I think that it isn't a big deal.",Claim
"However, it does not mean that air travel should be more expensive.",None
"In conclusion, people from unfortunate countries need more international assistance while helping citizens in the home country is also necessary.",MajorClaim
There are a lot of reasons to recommend this method for who is serious about learning some thing in their lives.,None
"For example, via skype people not just communicate with their family members and friends, but also make interviews for employment, enrolment into universities.",Premise
"Second, parents always tell students that the adult life is much tenser than school life.",Premise
"For instance, I made a month-long backpack trip through Southeast Asia last summer with my girlfriend.",Premise
"As far as I am concerned, a large shopping mall provides a location for residents to pursue during their leisure time.",Claim
"On the other hand, i believe that if we are passionate about what we are working, we are likely to achieve success easily in that field.",Claim
"The internet, for example, provide knowledge in the form of news, radio talks, tapes or reseachs on any particular fields.",Premise
"However, artists should also know not to hurt the sentiments of the people.",Premise
"Futhermore, there are plenty of works that using traditional way is unique method.",Premise
"Besides, all the learners are probably from the same country, so all these people most likely have learned the language, more or less, in the same way.",Premise
"To sum up, art is a very valuable object for every country and the talent in this area cannot be discovered everywhere, so I think governments should help and encourage artists to continue their work.",Claim
"During our trip, it is worthwhile for us to visit a museum of a new place.",Claim
From my point of view big cities can be a good place for bringing up children.,MajorClaim
"If it is a crucial win to acclaim a trophy, you will be ""on site"" to witness and celebrate the victory.",Premise
"For instance, if a student get a job in a company but he is frequently late for work, the company may reduce his payment or even fire him.",Premise
"Overall, I believe that students should study at school.",MajorClaim
"In conclusion, it is a significant obligation of citizens to pay tax to the government.",None
"Similarly, internet capable phones help influence the young ones to become more interested in chatting and social sites rather than doing school works.",Premise
"In todays world education is getting expensive, and people are tending to apply for self-finance education in order to get the admission.",Premise
"Moreover, their friends in the same industry can even help to write recommendation letters to some certain companies.",Premise
"With that development, food can be prepared more easily and it can taste a lot better than it used to.",None
"At the weekends, there is a great number of things to do in the metropolis.",Claim
"Besides, advertising might lead to healthier eating customs due to the growing awareness of living under a better lifestyle.",Claim
"For example, tourism makes up one-third of the Czech Republic's economy.",Premise
Studying alone helps us to focus more in our lessons.,Claim
"After a while the situation became clear, but before that a lot of people had already condemned the actions of Russia.",Premise
"In globalized world, the economies of several countries are in a big network and must influence on each others.",Premise
"To sum up, everything has its own gains and losses and advertisement is not an exception.",None
"For example, the estate industry will be boosted in order to satisfy the workers' accommodation need.",Premise
"Furthermore, most of these juveniles are students so they would need their parents to support them financially for what they want.",Premise
"On the other hand, some people are concerned that technology may have a detrimental effect on the traditional lifestyles.",Claim
"To improve education, spending more money to raise professors' salary is inappropriate.",Claim
"Moreover, a local museum could be a top choice and destination for tourist to visit.",Claim
"Thus, human rights is violated if artists are not allowed to express their feelings freely.",Claim
Learning in classroom could provide more information to study.,Premise
An apartment offers more privacy because you can choose to have your own room instead of sharing with another student.,Premise
"Young adults will feel reluctant to discuss such problems with their parents if they move out and live on their own, and thus missing the valuable input of their parents.",Premise
"Through those impressions, a person was easily to get acquired with others and blended with the community that surrounded him as soon as possible.",Premise
Many people claim that it is because of sedentary lifestlyle.,Claim
"In other words, advertising may even bring healthier eating habits to the people.",Claim
"Lastly, children usually mirror themselves on their parents.",Claim
"Another problem that the young adults may encounter is to find a co-tenant, who they do not like.",Claim
"If we use the public transportation, less cars will be used and less pollution will be emitted.",Premise
"In group works, group members gather together to have brain-storming discussion, think over every possible solutions and then finally reach an agreement.",Premise
"Thereby, evaluating from students is one of the ways to improve quality of educational system.",None
"Although I conceded technology may make people's life complicated in some aspects, the convenience it brings is more.",MajorClaim
Fame is a great responsibility for public people as their admirers are very sensitive to any acts of their idols.,Premise
"Serious movies usually designed to express one or more thinking about love, humaneness; moreover, it may point out the dark sides of the society.",Premise
"Recently, there has been a social concern with regard to whether or not mobiles phones have negative effects on our social life.",None
"In the same way, a skillful man contributes favorably and is valuable to the society.",Premise
"Moreover, government cannot equalize the price of creation of modern artist because there is no certain parameter to value it, art value is about taste.",Premise
"Since in an apartment you don't have a roommate, you won't have this problem, and as a result you would be able to concentrate better.",Premise
"Fortunately, the innovation of plane and train solved the geographical barriers.",Premise
"Today, even some disabled people with serious vertebral injuries can start doing physical activities like walking again thanks to the continuingly efforts of biomechanical engineers and neurologists.",Premise
"This ability is helpful in communicating with other workmates, cooperating with other workers needs this ability, too.",Premise
There is no doubt our life has had a change for the better since cars were introduced.,None
There are many different opinions regarding hobbies.,None
Here are some reasons and examples to illustrate my viewpoint.,None
Many people believe that children should study at school to have more knowledge that prepare better for their future.,None
"Lastly, it is more likely for us to buy goods in lower price in the shopping center, and save our time on the other hand.",Claim
Raising the salaries of professors so?,None
Public retain differing views on whether to teach students all subjects or just focus on one subject.,None
"In other words, reducing risks and enhancing individual's capability is the most important path to success.",None
So dancing is important in every culture.,Claim
"It has been proved that overusing of the electronic devices including mobile phones could lead to higher possibility of suffering hearing loss and even cancers, although the further investigation are needed.",Premise
Charging drivers one more fee makes no sense and is ridiculous.,Claim
"Thus, having classroom could provide abundant skills to students.",Claim
"However, one needs to be aware of all the pros and cons and beware of malicious things.",None
"For example, pupil who want to study science are also like to learn music.",Premise
"Moreover, the dullness of course may deeply influence their passion on study.",Premise
My friend went to a course where he learned how should work rapidly and now he is working.,Premise
"I favor the former; that is, I agree that face-to-face communication is better.",MajorClaim
"Also it is ridiculous if you think world wide webs such as Google, Yahoo etc.",None
And that kind of knowledge speaks very highly of you.,Premise
But this mistrust continued and created very unpleasant situations for everybody in my department.,Premise
"One of the major concerns against freeing artists' creation derives from the fear of social misleading which would destabilize the society; however, I believe the audiences have their own judgement and are not likely to be misled or influenced by some art work.",Premise
Take the example of use of food processors in kitchens.,Premise
Paying taxes is the obligation of citizens in almost every country.,None
"Some people think that life is a struggle, which means we may encounter numerous difficulties during our lives.",None
"In conclusion, students can learn more thoroughly as well as showing respect for professors and themselves through attending classes.",MajorClaim
"Some people think we should focus on our jobs, but I don't agree with them.",None
They have a serious impact on people in their puberty.,Premise
This was due to the lack of adequate controls by authorities and lead to a bad image of Thailand tourism.,Premise
"So it is quite necessary for the local residents to take actions and ensure the safety of the communities, by doing things like reporting suspicious activities to the police department.",Premise
"We need farmland to grow crops such as wheat and corn, and there is no doubt that without food people cannot alive for more than some weeks.",Premise
"For instance, when Vietnam became the champion of SEAGAMES for the first time in 2008, a festival atmosphere permeated into the streets.",Premise
"On these days, with the assistance of advertisement, people easily purchase the best products with detailed information and instruction for their requirement.",None
"Under proper use of technology, the human being can be benefit a lot and perpetually from the advancement of it.",Claim
Doing sports or hobbies for a short time can recharge our batteries.,Premise
"In addition, sometimes animals from hot countries have to survive in the cold winter of somewhere in Europe.",Premise
Working hard and saving money for later on investments is a great way of getting a satisfying feeling and to reward yourself for something you have accomplished.,Claim
"For me, I believe parents and educators should attach more importance to traditional games.",MajorClaim
"Besides, watching television has some cons and at the same time has very good pros.",None
I am totally agrees with the statement for some reasons.,None
"For example, one research fellow may want to know how a small village named Oramaki in Japan was suffering after Second World War.",Premise
"When people have jobs, they did not have to steal money.",Premise
"Meanwhile, historic buildings can be a source of maintenance fees.",Claim
"Remember if you are afraid of encountering difficulties, then you will be in the troubles all the time.",None
"By tutoring them, i earned some money and bought me books with it.",Premise
A large number of industries fire many forces because of doing their works by new technologies and computers.,Claim
Doesn't self-study more efficient?,None
"Nowaday, industrial in many countries still emit high intense of carbon dioxide, which caused of greenhouse effect.",Premise
"As far as I am concerned, sustaining the traditions will make the immigrated people keep their cultural identity and give them confident among the many culture society.",MajorClaim
"To conclude, I want to say that it is very important to be confident of the information, which you use, especially when your conclusion or decision may have a great influence.",MajorClaim
"It is much easier for us to contact than any other person in my department, which made me popular there, and much easier to get the help that I need.",Premise
"In the same way, the use of nuclear energy as an alternative to the hydro-kinetic energy causes less atmospheric pollution.",Premise
"All in all, protecting endangered animals is necessary, nevertheless, human needs for farmland, housing and industry are more important.",Claim
"The core and most profitable technology of an IT company is invented by a worker with excellent computer knowledge, not a worker with outstanding communicating skill.",Premise
"In this way, communication between family members is visibly destroyed.",Claim
"With newly developing technologies, people are able to carry various tasks more convenient and easy.",None
"Secondly, the zoo also serve as a means of ecological protection.",Claim
It is illogical to believe that these rational folks will not conduct themselves decently if required to do so.,Premise
"For example some students are not so active on the lessons, cause they are already familiar with the issue.",Premise
"Secondly, the tax reduction for parents of children studying in private schools would lead to a waste of public capital.",Claim
"To begin with, children might not be really comfortable with the use of a language other than their native tongue when they are in their kindergarten years.",Claim
"Overall, it is easy to distinguish between a child having two languages and a child having just his native language while comparing their ability to communicate, understanding other studies, etc, to find that why children should start learning a foreign language in the beginning of the education.",MajorClaim
There is no doubt that money has become key ingredient in various walks of our life than before.,None
The advent of the computer is one of the results of the development of the advantaged technology.,None
"In fact, some students may be capable in high schools, but the pressure of higher education is tough even for talented ones.",Premise
It is well known how important it is to exercise regularly to help the body system to work better.,Premise
"Importantly, capital punishment saves a lot of government funding which is wasted in maintenance of these hardcore criminals.",Premise
The last thing is about education.,None
"As we know, there are impoverished or disabled people in every society, needing help and support from others.",Premise
Let me explain it in detail.,None
South African national and traditional songs were played in the streets throughout the night.,Premise
My neighbor Tom once was a computer engineer in a big company.,Premise
International aid is critical because people from other countries may be facing much more serious problems.,Claim
"Hence, death penalty neither controls the violent in society nor creates a violent culture.",Claim
