text,label
"In short, without any limitations, there will be more awe inspiring work from our artists.",Claim
He said that I was totally failed in building a good friendship and he did not want to be one of my friends anymore.,Premise
"But working alone is a longer-term job than communicating, that is, the ability of adapting oneself to a new environment may be necessary for a fresh worker, but the excellent knowledge of this job will be benefit till one leave.",Premise
"To add to it, excess emission of carbon dioxide gas mainly by vehicles around the world has increased the average temperature at north pole which in turn has increased water level due to gradual melting of glaciers.",Premise
These social problems may impair the quality of life in the community.,Premise
"I personally disagree with this notion that these types of communication, telephones and email, made people less personal.",MajorClaim
"With that change, peoples lives are a lot better for several reasons.",None
It is my belief the tendency of getting extra jobs will increase more in the future.,None
"Besides, interaction help employees improve their communicational skills, therefore, they will have more and more friends and relationships.",Premise
"If you dont take any risks, you will have an ordinary life with average successes.",Premise
"When people exercise, the neuron cells in the brain release a chemical compound named Dopamine.",Premise
There are clearly advantages to exams.,Claim
"Public transportation keeps society from the depletion of natural resources, the air pollution, the loss of a sense of community.",Claim
"In conclusion, being different and unique is the better way to achieve success.",MajorClaim
"Yet, its merits still outweigh these downsides.",Premise
"All in all, protecting endangered animals is necessary, nevertheless, human needs for farmland, housing and industry are more important.",MajorClaim
"In the first place, humans are a part of the society, and the society includes a wide variety of groups.",Premise
The appropriate age at which a person should stop working is now a much debated issue in the society.,None
"Lastly, the studying conditions are better in an apartment because you don't have all the noise and distractions that you often have in dormitories.",Premise
"In my point of view, disadvantages of overemphasizing on personal lives of famous people by media outweigh its advantages.",MajorClaim
"In my opinion, advertising is the major reason for high sales of a product for several reasons.",MajorClaim
Another reason is order to gaining higher education degree as it is required to establish a person's career.,None
"Last but not least, every communication needs fluency so people can understand each other exactly and remember it for a long time.",Premise
"Therefore, the hardship of communication may be developed.",Claim
"With this kind of power big cities offer more opportunities for one's career advancements and a more chances of higher income that small towns does, and higher income can be the basis of a happier, healthier life.",Claim
"If parents get the children all they wanted, they would be run out of their money for their essential needs.",Premise
"Thus there is no reason that governments should hesitate to invest in public transportation, a healthy, safe and economical way of transporting.",Claim
Universtiy is an entrance to life.,None
"However, everything has pros and cons.",None
They would be able to understand other cultures and costumes.,Premise
This can benefit them in future when they intend to open up their own companies or hospitals.,Premise
"Therefore, mobile phones have shortened the distance of communication.",Claim
The directors manage employers and give them the deadline of projects.,Premise
"In addition, making a rushed decision could also mean that the person is missing out on a potential opportunity.",Claim
"Still, I am firmly convinced that the reasons I proposed in favor of my own sentiment are much more tenable and plausible.",None
"As a result, such activities can equip a child necessary skill that is useful for his future career.",Premise
I came across a situation once such that one of my subordinates used to suspect his co-worker for carrying tales to me.,Premise
"By way of conclusion, I do not root for the idea that restrictions should be put on artists work; on the contrary, they should be encouraged to express their innovative ideas  this world needs them to make itself colourful.",Claim
"Moreover, people who work at home are more likely to miss the important events happening in the office, like some announcements from the boss.",Premise
"To conclude, it is now evident that there should not be any restrictions on artists' work.",MajorClaim
"However, I do not see any rational in believing in luck to reach one's goals.",Claim
"Therefore, society should be educated and became aware of health issues so that the potential precautions on the way of illnesses can be taken instead of trying to provide treatment for the increasing number of patients.",Claim
Recent death statistic released by the Malaysian Ministry of Health shows that the top killer was lung related diseases caused by smoking.,Premise
This experience change me to concern about making plan for my future life.,Premise
"In addition, a boy would know how to speak with a girl in every situation and vice versa.",Premise
"Therefore, they will be able to learn about different cultures and different ways of thinking.",Premise
"The increasing tax and the expansion of local markets for accommodation, luxury goods amongst others are also a result of a solid, well-regulated tourism programs.",Premise
"For instance, after studying and sitting in the classroom for the whole morning, it is better for students to do some outdoor activities, such as stretching, jogging and playing ball games, in order to improve their learning ability during the afternoon classes.",Premise
"This is sure to lead to more carbon emitted into the atmosphere, which can cause skin cancer and destroy the natural environment.",Claim
"Also, it provides many advantages.",None
It is true that just giving aid to impoverished countries could be manipulated by big power countries.,Claim
"On special dates, city offers free exhibitions which are available for everyone who is interested in art.",Premise
"Secondly, watching television is a very passive action and should not be promoted by increasing periods spent on it.",Claim
This would not happen or at least would happen rarely if one decides to spend time with one or two close friends.,Premise
"In my opinion, though competitive children will be far more clever and faster than the co-operative child in an initial level, but it will not help them to be on the success path for the long run; while on the contrary, co-operative child will have a potential of structuring and implementing new and innovative ideas with the help of a team.",Claim
"In addition, students also have to focus on their study, and try to maintain their grades higher.",Premise
"More importantly, they have activeness, inventiveness and enterprise which allow them to complete their jobs perfectly.",Premise
Should the Government Provide Free College?,None
"Apart from that, a fair trial can be achieved.",Premise
"If you kill a criminal, you become a criminal.",Premise
"On balance, I have to consent to the use of technology in education, as it expedites data availability and accelarates students' learning process.",MajorClaim
"Secondly, there are some drawbacks about this issue.",None
This salary gap between those famous people and us leads to a question-do those professional athletes and entertainers deserve this money?,None
"Admittedly, the study of art and music is supposed to rely on younger student's own interest.",Premise
However I never encourage tale carriers as a principle and therefore his co-worker gave up talking ill against him with me.,Premise
"Moreover, in terms of punishment, living a miserable life with restriction to the world outside and sustaining the feeling of guilt every day in a dark bounded room are much more obsessing than being killed right away.",Premise
Many colleges in foreign countries provide vacations to students after each semester that facilitate student to entertain themselves as well as prepare for their next semester.,Premise
"In my opinion, this plan should be put into practice for the two reasons mentioned accordingly.",MajorClaim
"We should make full use of the past, instead of ignoring it, for a better and brighter future.",None
He also has access to the most up-to-date language.,Premise
"Although governments invest money on doing that, it is hard to gain the good results.",Premise
"Many people say that television has negative effects on children, since it can be violent or inappropriate for children.",None
Humans should be able to use animals for their own benefit?,None
"However, in my perspective, both public services and arts worth investment.",MajorClaim
"Therefore, I would conclude that thriving economies and the preservation of ecosystems can be promoted simultaneously.",MajorClaim
They start to pay attention to mental requirement like happiness.,None
Many companies know about this behavior and use advertisements on television to make people buy more of these foods.,Premise
"For instance, children immigrated to a new country will face social troubles in school with new friends.",Premise
"And this definitely helps to reserve our invaluable natural resource, gasoline.",Premise
"In fact, in order to develop a country, citizens must obey laws, which were imposed by the government.",Premise
"For a long time, the zoo has been a second home to endangered animals.",None
I agree with the statement that our life seems tough at the time but those difficult experiences of life become important lessons for the future.,None
"Since our parents receive better education than our grandparents did, they can provide more advices and helps in our career.",Claim
Old buildings should be used as the culture museums and provide accommodation with more convenient for people who live there.,Claim
A world sportive competition event is watched by almost every country around the world and provide social stimulus and people gathering.,None
The historic buildings show the history of our ancestors.,Claim
"Thus, they find hard to have time to prepare and cook a meal.",Premise
Start with find cause of problem and the way to do research to solve the problem.,Premise
"Though animal experiments have negative impact on the natural balance, it is necessary to make sure that people can live a long life.",Premise
It was fun and a little bit similar to the cinema.,Premise
"By way of conclusion, it is my belief that distance-learning will become increasingly important in the future as the pace of life increases.",MajorClaim
"On the other hand, without the requirement of environmental preservation, the firm would still consume a vast amount of energy which constitutes a large part of its operational costs, being a hurdle to the economic development.",Premise
"By doing this, outdoors relationships may expand and it may accompany with sexual relationship and as result, their thoughts deviate from the studies.",Premise
"For example, setting event once a week to gather everyone in family to spend time with each other.",Premise
He granted huge sums for such idea.,Premise
"In conclusion, as I believe that consumers should consider major needs when they purchase goods, high sales are obviously a reflection of the powerful advertisements.",MajorClaim
Student's who works tend to gather better financial resources which they can rely on during their university studies.,Premise
The repercussion are so severe that their families and friends remain deprived off their attention and in the end they end up losing balance between their family and personal life.,Premise
"Therefore, high school students should learn broadly and prepare future learning at university.",Claim
Because the best conditions are sometimes not likely to be good as the expectation of people.,None
Another reason is that a large number of friends can help you to consider all the possible solutions to a problem and to make you more open-minded.,Claim
"Although these workers do not produce profit directly, what they do is for the well-being of the whole society.",Premise
"In conclusion, traditional learning still has many benefits to the students.",MajorClaim
"Obviously, this reduction would cause a difficulty to the tax calculation; therefore, the government would have to recruit a greater workforce in order to handle this sophisticated issue.",Premise
I think it is a global problem to solve this problem and it is need global contribution to find a solution.,MajorClaim
"To begin with, the major cause that leads to urban migration of young adults is that cities often offer more well-paid jobs and study chances compared to rural areas.",Premise
"Especially when you don't have an instructor there to guide you, it is up to you to make sure that you understand and complete all course requirements.",Premise
"For example, some culture people believe that they dance in order to sacrifice to their god so they will be get a happy life.",Premise
"There you learn, to find your first love, to make new long-lasting friendships and of-course you will have a lot of fun.",Premise
Some people may argue that allowing policemen to carries firearms can increase violence in the society.,None
"While some appear to believe that advanced plant foods incorporate with newly developed devices significantly reduce the cost of producing farm products, others argue that this collaboration exerts a series of negative effects to people's health condition and the society.",None
It is because people nowadays are required to work as a team in their jobs frequently.,Premise
"For Toefl IBT Coaching first I was depend on some online courses, but after 1 month I realized that I was wasting my time so I joined an institute for preparation of Toefl IBT, and in 1 month I felt that my English skills have been improving faster.",Premise
There are different reasons which persuade that people should not restore old buildings.,None
"Alternatively, if you would like to have a trip across the ocean, a plane can carry you there in only a few hours, which is hard to imagine in the ancient times.",Premise
An experiment conducted by the Beijing University asked two groups of people to discuss the budget of an activity.,Premise
"While the money is not given to individual students, these contributions are not trivial.",Premise
There are still places in nearly every country in the world that cannot be reached by public transportation and can only be visited by car.,Premise
"On the other hand, criminal mind seems to be more related to violence.",Claim
"For example, if a child works as a shop assistant, he will have to keep an eye on good and products, calculate prices correctly and take responsibilities for any lost.",Premise
"Hence, I agree only to certain degree that in today's world, image serves as a more effective means of communication.",MajorClaim
"Nevertheless, supporters would argue that zoos, which are equipped with modern facilities and professionals, would provide better care for the animals inside.",Claim
"But during our childhood, though responsibilies exist, we are much more free to do what we would like to.",Claim
"It is undeniable that when they are given the opportunity to express themselves, most artists will think out of the box and come up with spectacular Arts such as paintings or movies.",Premise
"People can still acquire different viewpoints about foods from other sources, like news or magazines.",Premise
"Nevertheless, with all the mentioned demerits, computers have provided security and sophistication too.",Claim
"That is not to say, however, that advertisements have no downsides.",None
"From my point of view, the advantages of building a factory will outweigh its disadvantages, if we tackle the environmental problems brought by factories.",MajorClaim
"Even if we ignore this result, by the same token, you can get higher position and more money.",Premise
"However, from my point of view, television has more bad than good because it has made people not to have conversation each other.",MajorClaim
"Students who take break, gain lot of benefits by traveling around the places or by working.",Claim
"Search engines such as google, yandex with many features relevant to the characteristics of the information needed enable search of information in few minutes.",Premise
Educational rights must be given to both genders.,None
This means some powerful countries provide financial support in order to acquire the right to exploit the local resources and target the local labour market.,Premise
"Besides, girls are more likely to prefer some jobs related to emotion and communication, such as teacher, singer and interpreter.",Premise
"Think about the big project that a group is working on, if any group member has new idea about the project, he/she can assemble his/her colleges right away and discuss.",Premise
"First of all, we need to consider that police armed with guns or any other kinds of legal weapons just attempts to protect not only civilians but also himself.",Premise
"If I worked in the different field from my father, I would have faced much difficulty than I do now.",Premise
"However, the warmth of the materials, the heart pine, marble, or the old brick, all those old buildings features call back of our inner peace.",Premise
We will always be able to decide our own lifestyles.,None
"Due to the convenience of current technology, people can do their works everywhere as long as they have the equipment around them.",None
They know something which are not incorporated in such materials as books and webpages.,Premise
"In present educational system there are variety of competitions in academic area and athletic area for children to attend, which could stimulating the will of children to learn and to achieve the best of them, and also be able to teach them teamwork skill.",None
"A good advertisement can convince people to believe that it is what they want, even though it is not the real needs of the society.",Claim
"However, when the mistake friend made was not a big problem, we need to understand friend and forgive it because a friend is a gift of our life.",Premise
The fact that students nowadays do their homework or researches on computers rather than go to libraries is an illustration for this.,Premise
"A case in point is the reading and listening parts of TOEFL iBT exams, as candidates have to answer many questions in a limited period of time.",Premise
Todays life has some difficulty which become comfortable with the help of industry.,Premise
"Thus, capital punishment protects the society from hardcore criminals.",Claim
"However, things have been changing all the time.",None
Transportation cost is less than in big cities and we have less traffic so that we can save time and money.,Premise
"In addition, job can provide money to us.",Claim
"With the help of research projects, professors could lead their students into the practical world from the classroom.",Premise
"Some students still rely on classes to keep up with the courses, while some students don't feel the need to attend classes because they believe that they can handle the exams.",None
"In my opinion, I believe using single language through out the world is a positive change which is helping the world to become a better place to live.",MajorClaim
Should the cost of medicines be reduced?,None
"In my opinion, although using machines have many benefits, we cannot ignore its negative effects.",Claim
"With the rapid development of economy, the controversial of good worker's requirement is always in a limelight.",None
It is true that many poor families are not able to afford tuition fees for their kids to attend a course.,Premise
"Fortunately, there are other measures to improve the situation.",Claim
"In conclusion, if children take part in some kind of paid work with their parents' permission, they can learn lively lessons and become mature and responsible.",MajorClaim
The reduction in cost of medicines therefore shows the sign of humanity.,Claim
"Obviously, showing people how to exploit a land and get good agriculture products will push people to think about working in the field of agriculture rather than working in business or other field to make money.",Premise
This essay will discuss some arguments for and against animal domestication.,None
"However, up to this day his luck has not appeared and problems have got further worsened.",Premise
"University students can be divided into two groups, one group with less interest to study and the other which include hard working students.",None
"Presently, it is commonly accepted that students have to learn over eight subjects in school.",None
"Now, many students learn from Internet after class and they find it quite helpful.",None
"Despite the development of modern society, the health care and education still remain the basic rights of citizens.",None
Some of them had no own savings.,None
"In addition, the Internet gives everyone access to the same information, this therefore leads to greater equality between individuals.",Premise
I want to live here because I love the traffic system in here.,Claim
"For example, if you want to learn driving a car or some jobs like medicine and engineering and some sports like skiing and swimming, you'll have to find a teacher.",Premise
Not allowing students their desired subjects to be chosen is a restriction of human rights.,Premise
Competition helps in improvement and evolution.,Claim
I was in the Management Information System department.,None
This saying is stating that every fast and not well thought decision is a wasted one.,MajorClaim
"These resources such as oil, coal are vital for human activity, therefore nowadays, the exploitation activities of these resources are increasing dramatically to adapt to the infinite need of people.",Premise
"However, while the majority of people live on the fast lane, others decide to reduce the speed and take their time.",None
"For instant, sometime when I argue with my friends, I cannot express my self to my friends at that moment.",Premise
"From my point of view, advertising will be better if producers and advertisers are more honest in producing advertisements to give people the general view on one product.",None
"Because it can not only benefit our employers, but also ourselves will be rewarded.",Claim
They prefer male staff for night shifts.,Premise
People have various different views about cheap air travel.,None
"Even though there are some advantages of leaving school to find a job, studying at school is always the best choice for children's future.",Claim
Increasing the motivation and competence spirit are another benefit of group-studying.,Claim
"As far as I am concerned, I agree with the view that the teacher is the best option for children's education in some aspects.",MajorClaim
"In conclusion, I strongly agree with notion that dancing is an important part of culture because dancing are represent to believe of people.",MajorClaim
These languages are the basis for the origination and initial communication between different cultures.,Premise
"In addition, people who know a wide range of is better than people who know just one.",Claim
The world should consider clearly about polishing the law of the dead penalty.,MajorClaim
"Although some people think that the major part of school schedule should be entirely devoted to academics, I truly believe that the physical education part should not be outweighed.",MajorClaim
But I believe that by allowing students to watch TV at both school and house can adversely impact on their overall growth.,MajorClaim
"In addition, Learning a foreign language helps students tremendously to comprehend what happens in the around World.",Premise
"Without Earth, whatever great civil constructions and economic achievements will end up in vain because we will all perish as she's gone.",Premise
"In conclusion, high salary for athletes is what they deserve in accordance with their own achievements and also a guarantee for quality performances.",MajorClaim
I believe that education is the single most important factor in the development of a country.,MajorClaim
"Hence, I think international tourism leads to both tension and understanding between people from different culture.",MajorClaim
"Hence, even though freedom to express ideas can bring some negative effects, I certainly believe that there are many wonderful and beautiful Arts due to the freedom to express ideas and thus, I strongly believe there should be no restrictions on them.",Premise
"In contrast, in distance learning, these aspects of the professor had reduced their important.",Premise
"In summary, spending budget for space exploring is not the waste budget, because it may helps to save civilization of humanity.",Claim
"I have observed that many of the interested scholars failed to get the admission in good universities because they have to think about work along with the studies, and this left them with only one choice, which is work.",Premise
"First of all, it is not possible for everyone to visit a foreign country to learn a foreign language as it requires large amount of money and legal formalities.",Premise
"The issue is controversial but in my opinion, pets should be treated like human beings for different reasons.",MajorClaim
"For another, mechanical reaper causes the rise of the unemployment rate in the farming industry, possibly because high-end reaping plants replace a large number of workers in the fields.",Premise
There is panic among people that their conversation can be intercepted by the third party.,Claim
