text,label
"In my personal opinion, I am totally agreed with the view that there should not be any room for partiality in terms of gender while allocating seats for students in every university courses.",MajorClaim
Another important point is that for practical subjects you have to have a teacher.,Claim
"Consequently, it seems not easy to increase petrol price instantly.",Claim
"Furthermore, past record might be useful to decide whether a person was able to perform a certain type of crime when it concerns serious crimes, such as kidnapping or a murder.",Premise
"Therefore, it seems not unreasonable to suggest that this is a positive development.",None
And also when you see an airport?,None
"Blatantly seen, success of most companies stems from young people, whose enterprising ideas that catch up with the world is regarded as wind of refreshment.",Premise
With a good environment in college or university is encouraging students to study harder for a good future.,Premise
Good experiences give us good memories and bad ones teach us lessons for life.,Claim
"However, it is difficult to find a community which can perfectly meet our requirements.",None
"Secondly, even though environmental damage is inevitable, it is not tourism to be blamed for.",Premise
"Consequently, educational institutions are able to optimize costs by increasing teacher-student ratios.",Claim
"In contrast, it is really joyful for me that I can immerse in the joy of the victory and accomplishment.",Premise
"Consequently, the discussion class results in expanded children vision and their respect to others roommate's ideas.",Premise
Some details might be dim since the resolution ratio of the screen is not high enough.,Premise
People are corrupting their ecosphere.,Claim
They also provide funds for academic research.,Premise
"In short, this is not a long-term solution.",None
"However, strict laws, like capital punishment, are essential in a society.",MajorClaim
"Similarly, how can we live safely and joyfully when our home is devastated by, ironically, by ourselves?",None
"What is more, it is a pride of the country with a rage of culture which is easy to educate people to love their country more.",Premise
"Around the globe, the effect is evident on children also.",None
Family members such as your parents are experienced in life so they can give you proper and sincere guidance on every aspect of life.,Premise
"With the the tax amount for which they pay, the rich may help a vast number of students from families with poverty background to continue their studies, and earn a better quality of life.",Premise
"For example, I read about saving money for my retire is a good plan for my life.",Premise
"We can talk to them because they listen to us, more than some people will ever do.",Premise
Humans are not robots; we can't keep working for twenty-four hours.,Premise
"Obviously, people are looking for the solution such as understanding each other while they encounter the conflicts caused by international tourism.",Claim
"Although there are good arguments in favour of this trend should be encouraged, I personally think that cheap flight can make many serious problem.",Claim
"Last but not least, while generating energy from any source be it hydro power or oil there always is some wastage and so is the case with nuclear power.",Premise
"Therefore, i highly advocate that we should use mobile phone in moderation in order to avoid these serious problems.",None
"Consequently, making their life more complicated and tired.",Premise
"Once we get into the traffic jam, it forces us to waste our time for a while.",Premise
"For instance, In a classroom, teacher could give assignment to student to work as a group.",Premise
"But in fact, the good people do good things no matter the ending is good or not.",Premise
"My opinion based on the reasons that Every tough experience makes us more skilled, improves our decision making and makes us more compatible for life.",MajorClaim
Some people believe that these various advertisements get people to buy products that are unnecessary and only look good on television.,MajorClaim
"Technology and its advance, to some degrees, have influenced the educational industry positively.",Premise
"Obviously, violence in the media is often portrayed as extreme as possible in order to attract audiences.",None
The centre of research can raise the market part of this field by developing the agriculture products.,Premise
"Apart from that, images are also widely used in newspapers, magazines and advertisements.",Premise
"We did play video-games, but that wasn't our main activity.",Premise
"In addition, many teachers rely only on the exam results while grading the class, so the usage of standardized tests is the superior option for them.",Premise
"In this essay, I would start by analyzing the factors for higher yields and finish by stating my position on this.",None
And it's kind of art to make the best use of criticism.,Premise
These women will set a good example for their children.,Premise
"Secondly, online class could not provide knowledge about social skills.",Claim
It is of importance that workers should be well educated and trained to perform duties of their job.,Premise
"What is more, the factory is not isolated, other industries and business will be quickly established, resulting in economic growth of local area.",Premise
"When using public transportation, we have a chance to meet more people and more chances to discovery new aspects of life.",Premise
"Instead of using letters, technology advanced not only gives us more spare time but also convenient and efficient.",Premise
"However, research done by universities proves that student's performance improves if they get regular breaks from their learning, preparation and examination schedule.",Premise
Now that it has became strong economy country aiding poor countries after 10 years of aid from other counties.,Premise
"Moreover, teachers have a conspicuous role in assisting students for learning materials that being present at classes is a requisite for benefiting it.",Claim
"Taking all into account, I think that living in the city is much better nowadays, because of the opportunities it gives.",MajorClaim
"Admittedly, the computer can show whether an answer to a particular question is right or wrong but it cannot give as an in-depth explanation as a human teacher can.",Premise
"Compared to other hobbies such as going to theater or going to sports stadium, it is a very cost-effective hobby that gives viewer quiet a few indirect experiences.",None
"For example, in earlier times, people didn't leave for faraway places, because they could easily get lost.",Premise
That's why it is so important to be well-informed.,None
"During our life, it is inevitable that we may be related with any groups or organizations; therefore, groups and organizations are an important part of their lives.",None
"What is worse, people who live in countries that are confronted with wars or natural disasters are facing even more severe issues such as security, homelessness or the pain of losing best friends or family members.",Premise
"Also, instant food products take only a few minutes to be made into delicious meals.",None
"Some people, however, still believe that they can exist for long time; others disagree, arguing that newspapers have lost their competitive advantage to sustain their prolonged existence.",MajorClaim
"Finally yet importantly, appearing in class makes students more conscientious since they have to obey classs disciplines and they practice to be more perseverance in the process of doing their assignments.",Premise
"However, I am utterly convinced that these taxes are absolutely essential.",MajorClaim
"In addition to what mentioned, medical technologies is completely better in big cities and in my view this profit overcomes all the bad influences of technologies on human kind.",Claim
"Advertising also helps to keep prices at reasonable levels, creates a fair environment for commercial competition.",Premise
An apartment offers more privacy because you can choose to have your own room instead of sharing with another student.,Premise
"Not surprisingly, many people are worried that this attention to the famous people has an impact on them, especially on their children.",None
"The whole world aims for women empowerment, and to achieve this, females should be given equal opportunities as males.",Premise
"Last, but not least, financial sustainability of a region mostly depends on how healthy the population is.",Claim
"First of all, children generally have weak self-control, and thus they lose their time easily.",Premise
"At schools, students' development has been orchestrated stage by stage, step by step by experienced teachers, and their acquisition of knowledge is guided and backed up in a systematic way.",Premise
"Although, many argue that it provide good working experience, but I think it can interfere with their life in various ways.",Claim
"First of all, when students finished their high schools, they are confused about subjects that they are going to choose to study in universities.",Premise
"I would prefer to live in a small town and I think a small town has some advantages, such as good weather, a healthy life and better facilities.",MajorClaim
Way to reduce the amount of traffic?,None
"On the other hand, complained about the drawbacks of zoos are often heard.",Claim
Music and art are not like math or language which has more strict rules.,Premise
"Secondly, these workaholic people do not spend time for the contribution of society by actively participating in any social campaign.",Claim
"I'm a research asistant at a university, and as any of the univesity in ours we have a professor who isn't good at human relationships, most of the asistans don't enjoy to talk with him about any situation, although we have to ask about his field.",Premise
Universities have quickly become the places to go when people seek to further develop their expertise.,None
"Government budget focus, young children or university?",None
"Under the circumstances, he will learn that he has to obey the rule and take responsibility for their work.",Premise
"They have experienced a large numbers of stuffs during their life, so if children listen to their advices they can prevent happening worst things.",Premise
"This means, that the schools and the universities have well equipped classes and the famous professors would like to work in such places.",Premise
"In this case, those employees who did not plan and finish their assignments ahead of time perhaps are unable to finish these tasks on time and therefore will be penalized or get fired.",Premise
"Those who disagree, believe that globalization contribute effectively to the global improvement of the world in many aspects.",Claim
"Moreover, spaceships, communication satellites and space pens also contribute a lot to the society.",Premise
Public utilities and surroundings are the primary factors which we basically consider before we decide to live in a place.,None
Intrinsic motivation is known to be much more desirable because it leads to better learning and well-being.,Premise
"In my opinion, I believe that working at home is worse and less efficient than working in the office.",MajorClaim
"To sum up, I reaffirm that although there is some disadvantages of animals' profits, the merits of animal experiments still outweigh the demerits.",Claim
"However, some people point that technology has made children less creative.",None
"Research has shown that the more satisfied the students are with those life aspects, the better they perform in academic areas.",Premise
"As we are now live in a competent world, we must show ourselves to be great enough so as to convince the employer that we deserve a better payment.",Premise
One of the other factors for success in a future job is effective commuincation.,Premise
"Secondly, large emissions of carbon monoxide gas from refrigerants like air conditioners have depleted ozone layer.",Claim
"As well as it's one way of recent communications, based on that I think TV helps you to get connected with people.",Claim
Playing baseball provided my upper body for hitting and throwing.,Premise
"On one hand, solving some environmental problems needs large budgets and various technologies, and the government and corporations have the ability to deal with these problems.",Claim
"Moreover, parents are usually too busy with their daily jobs to teach their children the life skills.",Premise
"Firstly, computers need to be operated by people.",Claim
"For instance, there are more male scientists and engineers in comparison with females around the world.",Premise
"Some people claim that this is brought about by the care for animal rights issue, others think it is much beyond that.",None
"Finally one night, having fun with his irresponsible friend in his luxuries car, he crashed a truck and died.",Premise
"I think limiting the number of people who can be admitted by universities is a good choice since it will reward the motivation of students and constantly keep them in the difficult level of learning, which makes them do the best to improve themselves.",Premise
"In sum, I am sure; some people will oppose the idea of part time job for students.",None
"Second, besides the academic knowledge, the awareness of social behavior is an important factor for human's life.",Premise
This means you can get more for less.,Premise
"Therefore, it is our responsibility to keep as many species on the Earth as possible.",Claim
They are being rude towards others.,None
"Nowadays, whether to establish large factories nearby housing areas has become a controversial issue in our society.",None
"As a result of mental immaturity, most youngsters are incapable of distinguishing right from wrong.",Premise
"Some people thinks that if a child grows up in a big city they will be all day at home at the computer or at the video-game, but this is not true if you live in a neighborhood with other people about your age as I did.",Premise
"Firstly, most of the countries have the same educational system based on technology.",Claim
This make students have healthier life which online class cannot provide.,Premise
Anyone who aims to use these innovations have to not only pay for the appliances such as a mobile phone or a computer but also cover up costs for communication services.,Premise
For instance employers need male candidates for the heavy work such as repairing and installation of heavy machine.,Premise
"Nowadays, many countries are concerned with the environment problems.",None
I think both learning by myself and learning with a teacher could be helpful.,MajorClaim
"In other words, he is not jumping into the foreign country.",Premise
"Despite the importance of helping those beyond our national borders, it is reasonable to lend a hand to our fellow citizens.",Claim
"For instance, the most impressive professor during my studying in university is Mr. Yang who keeps in researching and reading.",Premise
"Some want to enjoy new experiences, some are going to prepare for their future career, while others are eager to develop their understanding.",None
"In my opinion, it depends on how you value these learning activities to be like.",Premise
"All in all, it is obvious that there is a poor relationship between polices carrying guns and an increasing violence rate.",MajorClaim
"To cite an example, Malaysia is a multiracial country whereby all the citizens live together in harmony and peace.",Premise
"As a result, statistics show a slight reduction in the number of smokers, indicating that they realize the effects of the negative habit.",Premise
The accidents cannot be completely avoided although only those who have gun licenses can purchase guns.,Premise
They can hit both the environment and human's life easily.,Claim
I believe that professors can always give students more than students themselves could because of the experiences and their qualifications as professors.,Premise
Most libraries are free not for students also for public.,Premise
And then he or she will teach me the course efficiently in a short time and therefore I will learn faster and better and won't get discouraged and confused.,Premise
"To illustrate this further, the money can be used to build more amenities for the public or given to the poor so that they can use it to help them earn a living.",Premise
"Since in an apartment you don't have a roommate, you won't have this problem, and as a result you would be able to concentrate better.",Premise
"The main reason is that students can learn lots of things from part time job, before starting their real job.",Claim
"Students can learn about time management, money management and convince people by their words.",Premise
"To begin with, the classmates themselves creat a competitive atmoshphere which incent the children.",Claim
"The necessary energy will slowly be used up, since people use less their own cars.",Premise
Many people enjoy challenging them because they don not want to be monotonous and passive ones.,Premise
"To summarize, higher fuel and petrol cost has its own pros and cons.",Claim
"Furthermore, students also have a chance to know about the community around them.",Premise
"Secondly, the staff soon gets boring with their stable job in such a long time.",Claim
"Different types of tasks during workday brings more challenges, making life colorful.",Premise
It is assumed the amazing performances they give to the audiences are only valuable in aesthetic and entertaining terms.,Premise
"In my opinion, I think buying habit is people's choice to make, not entirely affected by advertisements.",MajorClaim
Charity organisations have been playing an important role to provide support to those people.,None
"I don't want to disavow the role of luck in success, but as you know it hardly accompany us.",Premise
"What we acquired from team work is not only how to achieve the same goal with others but more importantly, how to get along with others.",Premise
"On the other hand, the importance of museums and art galleries is plain in terms of education and culture.",Claim
"Moreover, parents will give their children money in order they to focus only on studying.",Premise
"Thus, it is an oppertunity to learn how to deal with money.",Claim
"First and foremost, the Internet is an adequate source of academic information, which will potentially fulfill the needs of university pupils.",Claim
"On the other hand, growing of cheap flights really have negative impact on environment.",Claim
That goal has led me to my lost in interest on doing my homework and I ended up failing one subject in that semester.,Premise
These people depend solely on hard work and luck.,Premise
"Therefore, advertising is believed by many, a financial burden to businesses.",Claim
"Thirdly, providing training will make employees happy with their current job because it help them improve their professional business knowledge.",Premise
"To conclude, there are many ways to study and it is our right to choose which is suitable for our characters whether alone or with group.",None
People are no longer restricted in the office.,None
"As a result, unchecked and reckless uses of the local raw materials may happen, which can put a strain on the natural resources.",Premise
"Third, TV can be one of communication ways.",Premise
There can be no doubt that the burgeoning number of young adults from the countryside flocking to cities gives rise to overpopulation in cities.,Premise
"Nowadays people, especially inhabitants of cities, are spending most of their time on sitting in front of TV or other tools.",Premise
Visit museums can bring you the opportunity to establish relations and knowledge to participate in conversations.,Premise
"For example, if there is only one person smoking in a restaurant, all others will smoke unconsciously and their health is under attacked.",Premise
"In my point of view, though competitive child would have more motivation and perspective that leads them to success, but it would not help them much once they enter to society or company which required more about skill of team work.",Claim
Some people believe that this has brought more problems than benefits.,None
"Since now buses are only a kind of public transportation in this community, It makes people in this area have no choice.",Premise
"In addition, the basic economic course can also help with the students when they go to college.",Claim
"It would be unwise to still deny the truth and keep focusing on economic developments and unfortunately, usually the economic developments are even the causes of environmental damages.",Premise
"For instance, a defendant with number of past crimes has more chance to be found guilty compared to a person with no or lighter criminal record.",Premise
"It would be great if every zoo kept the animals in perfect conditions, but regardless of the condition, zoos are very useful.",MajorClaim
"Apart from the one I have mentioned above, another equally important aspect is keeping in high pace condition can prevent me from getting lazy.",Premise
"In such circumstances, even when the scientists want to finish off quickly, but they couldn't miss even a single part of the mission since it may trigger loads of problems.",Premise
"Students not only do homework, assignment and attend class but also need to participate in volunteer work, internship and part time job.",Premise
"There will not be such worries when young adults live in their own home, because parents will take care for them.",Premise
"In my opinion, the latter opinion is true.",None
"Over the time, there are also a lot of arguments concerning whether zoos are helpful in serving people or they are just some kinds of bad treatments to animals.",None
"Furthermore, students who migrate for better education would not have to go through lot of stress as they can easily make new friends and can be part of any discussions which is otherwise not possible in a world with multiple languages; this in turn makes it easy to adjust in new environment.",Premise
"It is quite common that more and more people can watch exhibitions through television or internet at home due to modern technology; therefore, some people think museums and art galleries will disappear soon.",None
"For example, in most asian countries, advertisement company usually hire popular singers or actors to advertise the products to boosts the sales, and some people, especially adolescent may buy things from their favourite singer advertised to support their idol instead of to fill their needs.",Premise
"For example, roommate turns down the music or television volume at night time.",Premise
"Thus, many people try to reduce their stress.",None
"Now, it is time to start without any regret from my previous exams.",None
People have a lot of things to learn in their lives.,None
"On one hand, it will be easier for people to assimilate into a new country, if they follow the new customs.",Claim
"In our hectic life, however, demand is not for musically orientated students, but for academically developed employees.",Premise
"Furthermore, it can have a negative affect on these students to require them to choose a subject in equal proportion of gender, and that does not conform to students' personality traits and mental development.",Claim
Most people nowadays prefer to use the Internet to search for art work because the Internet really brings them convenience.,Claim
"In conclusion, it is convincing that exams have a role to play in ensuring proper and objective assessment of achievement.",MajorClaim
"I found that I could find virtually every brand or store, including Macy's and JCPenney, when I visited there.",Premise
Almost half of the news coverage on television and the Internet is devoted to the celebrity gossip.,None
"They are the ones that teach, and will teach us to be self-esteem and experienced, which means their preservation throughout history deserve our attention.",Claim
"In conclusion, working with a group a people and working individually are all important.",None
"This current world we situate ourselves in is rather unpredictable, even one sudden invention could bring down all the notions we used bear in mind.",None
"Personally, a break will give students some time to refresh their systems, by traveling or following their hobbies.",Claim
"First, critics of zoology argue that keeping animals in captivity is wrong because animals should be considered non-human persons and they should have the right of having freedom.",Claim
"Finally, some people make the television a priority.",Claim
"However, only under specific circumstance, when students master all of the systematic knowledge, can they accomplish research.",Premise
Education is undeniably an economic necessity.,None
"Therefore, even if children are not going to be great musicians or artists, learning music and art is still worthy because it can nourish your temper and serve as a leisure.",Premise
"Ergo, opponents of this system should try to comprehend the situation and take actions to prevent themselves from being victims of crime.",Premise
"For instance, you can visit museums to learn history, and go to a more equipped library to enjoy reading, or you can go to a sports center for exercising.",Premise
"On the other hand, adults often consider such behaviors as childish and drop them immediately.",Premise
"Thus, I think undergoing with parents is worthwhile.",Claim
Smoking in restaurants can give a bad example to the children.,Claim
What's more important: hard work or luck?,None
"To sum up, I think adults do need to play games, but their styles are often distinct from children's, which are often less competitive and more enjoyable.",MajorClaim
